{
  "schemaVersion": 2,
  "totalMaterialised": 295,
  "open": 295,
  "completed": 0,
  "actionCount": 0,
  "byStage": {
    "metadataFix": 122,
    "manualReview": 0,
    "abstractReview": 173,
    "legacyRejectionReview": 0
  },
  "openByOrigin": {
    "legacy": 0,
    "daily": 295
  },
  "bySecondaryCollection": {
    "broaderAml": 0
  }
}
